{
  "apex": {
    "assertions": [
      "Scores below 600 remain Warm and the complete five-hop dependency path is attached to the test result.",
      "The deployment record reports compilation_attempt=1 and compile_success=true."
    ],
    "command": "sf apex run test --tests FidelityBenchmark015Test --result-format json --wait 20 --target-org ${TARGET_ORG}",
    "required": true,
    "test_class": "FidelityBenchmark015Test",
    "test_level": "RunSpecifiedTests"
  },
  "browser": {
    "artifacts": [
      "playwright/trace.zip",
      "playwright/video.webm",
      "playwright/final-state.png"
    ],
    "authentication": "sf_frontdoor_url",
    "base_url": "${SCRATCH_ORG_INSTANCE_URL}",
    "command": "node ../../tools/run_browser_case.mjs --descriptor execution.json --artifacts ${EVIDENCE_DIR}/playwright",
    "driver": "jataka.salesforce.case.v1",
    "driver_path": "../../tools/run_browser_case.mjs",
    "driver_sha256": "920ab62174bce82b177534b268d6ae7f00c2a149ef7b39e1178d659f748e64e4",
    "entrypoint": "SF-FID-015",
    "inputs": {
      "case_id": "SF-FID-015",
      "entry_symbol": "Account.Jataka_Credit_Score__c",
      "seed_source": "seed_command_stdout"
    },
    "required": true,
    "route": "/apex/FidelityBenchmark",
    "runner": "playwright",
    "scenario": {
      "actions": [
        "Open the affected Lightning record page as the affected user.",
        "Perform the user action that reproduced the original failure."
      ],
      "assertions": [
        "Credit review saves successfully and displays the package decision with its validation rationale.",
        "The Playwright trace contains no uncaught page or console error."
      ],
      "setup": [
        "Create a least-privilege affected user and seed the declared records."
      ]
    },
    "selectors": {
      "action": "[data-jataka-case='SF-FID-015'][data-action='run']",
      "result": "[data-jataka-case='SF-FID-015'][data-result]"
    }
  },
  "case_id": "SF-FID-015",
  "event_replay": null,
  "evidence": {
    "pass_source": "observed_runtime_only",
    "precomputed_results": false,
    "required": [
      "deploy-result.json",
      "apex-test-result.json",
      "query-result.json",
      "playwright/trace.zip",
      "playwright/video.webm",
      "playwright/final-state.png",
      "cleanup-result.json",
      "evidence-manifest.sha256"
    ]
  },
  "metadata_probe": null,
  "mode": "deploy_and_test",
  "package": {
    "api_version": "60.0",
    "fixture_bindings": [
      {
        "fixture": "fixtures/SF-FID-015/objects/Account/fields/Jataka_Credit_Score__c.field-meta.xml",
        "fixture_sha256": "80a3b2fc6339cadf99a757704337d762672d746eaae8bd115be2d92d225b2544",
        "package_member": "package/main/default/objects/Account/fields/Jataka_Credit_Score__c.field-meta.xml",
        "package_member_sha256": "80a3b2fc6339cadf99a757704337d762672d746eaae8bd115be2d92d225b2544"
      },
      {
        "fixture": "fixtures/SF-FID-015/flows/FidelityCreditReview.flow-meta.xml",
        "fixture_sha256": "3147490e6b263d4d94d1d46a39cc253b08f892e3f3ff561ac7ef3c905f72e331",
        "package_member": "package/main/default/flows/FidelityCreditReview.flow-meta.xml",
        "package_member_sha256": "069626c4ce8c55439263db3d19bf3dbb6534e028f8fec211edcd688131ee40fc"
      },
      {
        "fixture": "fixtures/SF-FID-015/classes/FidelityCreditAction.cls",
        "fixture_sha256": "f34a413cc042be9b2f16da108f250815426798524522d07c1cb78dac32835ed2",
        "package_member": "package/main/default/classes/FidelityCreditAction.cls",
        "package_member_sha256": "90fc12f682e41173737137db33cf6dab477baba6a0641530db64efee2c696dd2"
      },
      {
        "fixture": "fixtures/SF-FID-015/classes/FidelityCreditAction.cls-meta.xml",
        "fixture_sha256": "2d4aa15ffc3f7dee59accd322c084a696a3cce69705ebe994c97fbb9b2093237",
        "package_member": "package/main/default/classes/FidelityCreditAction.cls-meta.xml",
        "package_member_sha256": "2d4aa15ffc3f7dee59accd322c084a696a3cce69705ebe994c97fbb9b2093237"
      },
      {
        "fixture": "fixtures/SF-FID-015/objects/Account/validationRules/Fidelity_Credit_Gate.validationRule-meta.xml",
        "fixture_sha256": "e0974cddb1e9e1c6849fe1376cc14da79e1e0aaa87407281b73941934e577d2f",
        "package_member": "package/main/default/objects/Account/validationRules/Fidelity_Credit_Gate.validationRule-meta.xml",
        "package_member_sha256": "e0974cddb1e9e1c6849fe1376cc14da79e1e0aaa87407281b73941934e577d2f"
      }
    ],
    "generated_members": [
      {
        "path": "package/main/default/classes/FidelityBenchmark015Test.cls",
        "sha256": "bbccddf6176b724e7f2ad4a92b52ff189d8108350484983df7319b51d33fba14"
      },
      {
        "path": "package/main/default/classes/FidelityBenchmark015Test.cls-meta.xml",
        "sha256": "2d4aa15ffc3f7dee59accd322c084a696a3cce69705ebe994c97fbb9b2093237"
      },
      {
        "path": "package/main/default/classes/FidelityBenchmarkHarnessController.cls",
        "sha256": "d9b9a05be6ac73735de9e5ed3c18694055eb4b06cb6d131a3d78a1d859aa79c7"
      },
      {
        "path": "package/main/default/classes/FidelityBenchmarkHarnessController.cls-meta.xml",
        "sha256": "2d4aa15ffc3f7dee59accd322c084a696a3cce69705ebe994c97fbb9b2093237"
      },
      {
        "path": "package/main/default/classes/FidelityBenchmarkScenario.cls",
        "sha256": "87ae3a77eb25ba8ee5b2eab917ed23deed2f63aed383dd82efb4c452550c0a3b"
      },
      {
        "path": "package/main/default/classes/FidelityBenchmarkScenario.cls-meta.xml",
        "sha256": "2d4aa15ffc3f7dee59accd322c084a696a3cce69705ebe994c97fbb9b2093237"
      },
      {
        "path": "package/main/default/classes/FidelityCreditDecisionServiceStub.cls",
        "sha256": "4971abdf13dbdfdce124d44320867a3075c51477ca3164e1de414daedb8fe93f"
      },
      {
        "path": "package/main/default/classes/FidelityCreditDecisionServiceStub.cls-meta.xml",
        "sha256": "2d4aa15ffc3f7dee59accd322c084a696a3cce69705ebe994c97fbb9b2093237"
      },
      {
        "path": "package/main/default/pages/FidelityBenchmark.page",
        "sha256": "1666cde8ce94d12994022e831591f10fe5a6c66ba42600d74ecdc0eb02af51a4"
      },
      {
        "path": "package/main/default/pages/FidelityBenchmark.page-meta.xml",
        "sha256": "6541db68f73bc28f93ccccd1dba5dd5be8501dfddee9304feda06d836baf3f20"
      }
    ],
    "project_file": "sfdx-project.json",
    "source_adapters": [
      {
        "adapted_sha256": "069626c4ce8c55439263db3d19bf3dbb6534e028f8fec211edcd688131ee40fc",
        "description": "The graph fixture retains its method-qualified semantic symbol; the deploy bundle uses Salesforce's class-qualified Apex action name.",
        "id": "local-invocable-action-name",
        "kind": "flow_invocable_adapter",
        "original_sha256": "3147490e6b263d4d94d1d46a39cc253b08f892e3f3ff561ac7ef3c905f72e331",
        "production_boundary_still_required": false
      },
      {
        "adapted_sha256": "90fc12f682e41173737137db33cf6dab477baba6a0641530db64efee2c696dd2",
        "description": "The execution bundle substitutes a local Type.forName target so the managed-package transaction effect is reproducible without licensed IP.",
        "id": "local-managed-boundary",
        "kind": "managed_package_type_adapter",
        "original_sha256": "f34a413cc042be9b2f16da108f250815426798524522d07c1cb78dac32835ed2",
        "production_boundary_still_required": true
      }
    ],
    "source_root": "package"
  },
  "patch_contract": {
    "output_format": "jataka.ast.instructions.v1",
    "raw_text_forbidden": true,
    "sha256": "06df4c9b7e32d13018c6fe882418f444e7c84a75d8b0029c94d5f1f04104f24e"
  },
  "prerequisites": [
    "authenticated target scratch org",
    "AST compiler output bound to the source fixture SHA-256",
    "Jataka Playwright driver jataka.salesforce.case.v1",
    "live ncino namespace for production-boundary fidelity"
  ],
  "queries": [
    {
      "assertions": [
        "A score below 600 never persists Rating=Hot."
      ],
      "bindings": {
        "marker": "JATAKA_BINDINGS=",
        "renderer": "salesforce_soql_literal_v1",
        "source": "seed_command_stdout",
        "syntax": "${bindingName}",
        "variables": [
          "accountId"
        ]
      },
      "engine": "soql",
      "id": "sf-fid-015-postcondition",
      "read_only": true,
      "runner": {
        "command": "python3 ../../tools/run_query.py --descriptor execution.json --seed-result ${EVIDENCE_DIR}/seed-result.json --target-org ${TARGET_ORG} --output ${EVIDENCE_DIR}/query-result.json",
        "path": "../../tools/run_query.py",
        "sha256": "96a3f66e9624fc9d511c68c4c00b8a70d3741a843b6dee13b7a9b68e41f9939f"
      },
      "statement": "SELECT Id, Jataka_Credit_Score__c, Rating FROM Account WHERE Id = ${accountId}"
    }
  ],
  "schema_version": "1.0.0",
  "seed": {
    "command": "sf apex run --file scripts/seed.apex --json --target-org ${TARGET_ORG} > ${EVIDENCE_DIR}/seed-result.json",
    "declared_bindings": [
      "accountId"
    ],
    "idempotency": "fresh_scratch_org_once_per_case",
    "output": {
      "format": "salesforce_cli_json_log",
      "marker": "JATAKA_BINDINGS=",
      "value": "json_object"
    },
    "script": "scripts/seed.apex",
    "script_sha256": "a3ba26302f72b1cd7f08f2e287642bca116971650e6966f20c45bfad9f11b1d1"
  }
}
