{
  "apex": {
    "assertions": [
      "One update executes the handler once and preserves the intended normalized description.",
      "The deployment record reports compilation_attempt=1 and compile_success=true."
    ],
    "command": "sf apex run test --tests FidelityBenchmark004Test --result-format json --wait 20 --target-org ${TARGET_ORG}",
    "required": true,
    "test_class": "FidelityBenchmark004Test",
    "test_level": "RunSpecifiedTests"
  },
  "browser": {
    "artifacts": [
      "playwright/trace.zip",
      "playwright/video.webm",
      "playwright/final-state.png"
    ],
    "authentication": "sf_frontdoor_url",
    "base_url": "${SCRATCH_ORG_INSTANCE_URL}",
    "command": "node ../../tools/run_browser_case.mjs --descriptor execution.json --artifacts ${EVIDENCE_DIR}/playwright",
    "driver": "jataka.salesforce.case.v1",
    "driver_path": "../../tools/run_browser_case.mjs",
    "driver_sha256": "920ab62174bce82b177534b268d6ae7f00c2a149ef7b39e1178d659f748e64e4",
    "entrypoint": "SF-FID-004",
    "inputs": {
      "case_id": "SF-FID-004",
      "entry_symbol": "FidelityRecursiveAccountHandler",
      "seed_source": "seed_command_stdout"
    },
    "required": true,
    "route": "/apex/FidelityBenchmark",
    "runner": "playwright",
    "scenario": {
      "actions": [
        "Open the affected Lightning record page as the affected user.",
        "Perform the user action that reproduced the original failure."
      ],
      "assertions": [
        "Saving an Account completes once without a maximum trigger depth error.",
        "The Playwright trace contains no uncaught page or console error."
      ],
      "setup": [
        "Create a least-privilege affected user and seed the declared records."
      ]
    },
    "selectors": {
      "action": "[data-jataka-case='SF-FID-004'][data-action='run']",
      "result": "[data-jataka-case='SF-FID-004'][data-result]"
    }
  },
  "case_id": "SF-FID-004",
  "event_replay": null,
  "evidence": {
    "pass_source": "observed_runtime_only",
    "precomputed_results": false,
    "required": [
      "deploy-result.json",
      "apex-test-result.json",
      "query-result.json",
      "playwright/trace.zip",
      "playwright/video.webm",
      "playwright/final-state.png",
      "cleanup-result.json",
      "evidence-manifest.sha256"
    ]
  },
  "metadata_probe": null,
  "mode": "deploy_and_test",
  "package": {
    "api_version": "60.0",
    "fixture_bindings": [
      {
        "fixture": "fixtures/SF-FID-004/FidelityRecursiveAccountHandler.cls",
        "fixture_sha256": "7b7ddb1cd5f13ba5c6ff70852810a4510146c503aa9128f09355b9359c56a95f",
        "package_member": "package/main/default/classes/FidelityRecursiveAccountHandler.cls",
        "package_member_sha256": "7b7ddb1cd5f13ba5c6ff70852810a4510146c503aa9128f09355b9359c56a95f"
      },
      {
        "fixture": "fixtures/SF-FID-004/FidelityRecursiveAccountHandler.cls-meta.xml",
        "fixture_sha256": "2d4aa15ffc3f7dee59accd322c084a696a3cce69705ebe994c97fbb9b2093237",
        "package_member": "package/main/default/classes/FidelityRecursiveAccountHandler.cls-meta.xml",
        "package_member_sha256": "2d4aa15ffc3f7dee59accd322c084a696a3cce69705ebe994c97fbb9b2093237"
      }
    ],
    "generated_members": [
      {
        "path": "package/main/default/classes/FidelityBenchmark004Test.cls",
        "sha256": "30fa14b640fec412be16c6653a68b0cee101537c5f6426f7b15ee7064145cab9"
      },
      {
        "path": "package/main/default/classes/FidelityBenchmark004Test.cls-meta.xml",
        "sha256": "2d4aa15ffc3f7dee59accd322c084a696a3cce69705ebe994c97fbb9b2093237"
      },
      {
        "path": "package/main/default/classes/FidelityBenchmarkHarnessController.cls",
        "sha256": "d9b9a05be6ac73735de9e5ed3c18694055eb4b06cb6d131a3d78a1d859aa79c7"
      },
      {
        "path": "package/main/default/classes/FidelityBenchmarkHarnessController.cls-meta.xml",
        "sha256": "2d4aa15ffc3f7dee59accd322c084a696a3cce69705ebe994c97fbb9b2093237"
      },
      {
        "path": "package/main/default/classes/FidelityBenchmarkScenario.cls",
        "sha256": "46b44c0a3f9f652794ac7dbe229ecf3bb0f6eadf807507f391f932eb6820566a"
      },
      {
        "path": "package/main/default/classes/FidelityBenchmarkScenario.cls-meta.xml",
        "sha256": "2d4aa15ffc3f7dee59accd322c084a696a3cce69705ebe994c97fbb9b2093237"
      },
      {
        "path": "package/main/default/pages/FidelityBenchmark.page",
        "sha256": "d6bf5bc9c2bcaed9183a5e19faf1aa4e9263edeb7314654af2d6d3478d41915f"
      },
      {
        "path": "package/main/default/pages/FidelityBenchmark.page-meta.xml",
        "sha256": "6541db68f73bc28f93ccccd1dba5dd5be8501dfddee9304feda06d836baf3f20"
      },
      {
        "path": "package/main/default/triggers/AccountAfterUpdate.trigger",
        "sha256": "6e13980ed169a32e41b6a8cdbc1ee6a184340ce4385dad1fdbbef75e529cc10e"
      },
      {
        "path": "package/main/default/triggers/AccountAfterUpdate.trigger-meta.xml",
        "sha256": "3e281f4973f11ee8787ad60a6ce887072ab93d08026550ed06558fb797dde139"
      }
    ],
    "project_file": "sfdx-project.json",
    "source_adapters": [],
    "source_root": "package"
  },
  "patch_contract": {
    "output_format": "jataka.ast.instructions.v1",
    "raw_text_forbidden": true,
    "sha256": "b312d05436dde32f750d2beb4efba2cd78e69ab51270fc066c68ff56d2766709"
  },
  "prerequisites": [
    "authenticated target scratch org",
    "AST compiler output bound to the source fixture SHA-256",
    "Jataka Playwright driver jataka.salesforce.case.v1"
  ],
  "queries": [
    {
      "assertions": [
        "Description is Normalized and one audit event was emitted."
      ],
      "bindings": {
        "marker": "JATAKA_BINDINGS=",
        "renderer": "salesforce_soql_literal_v1",
        "source": "seed_command_stdout",
        "syntax": "${bindingName}",
        "variables": [
          "accountId"
        ]
      },
      "engine": "soql",
      "id": "sf-fid-004-postcondition",
      "read_only": true,
      "runner": {
        "command": "python3 ../../tools/run_query.py --descriptor execution.json --seed-result ${EVIDENCE_DIR}/seed-result.json --target-org ${TARGET_ORG} --output ${EVIDENCE_DIR}/query-result.json",
        "path": "../../tools/run_query.py",
        "sha256": "96a3f66e9624fc9d511c68c4c00b8a70d3741a843b6dee13b7a9b68e41f9939f"
      },
      "statement": "SELECT Id, Description FROM Account WHERE Id = ${accountId}"
    }
  ],
  "schema_version": "1.0.0",
  "seed": {
    "command": "sf apex run --file scripts/seed.apex --json --target-org ${TARGET_ORG} > ${EVIDENCE_DIR}/seed-result.json",
    "declared_bindings": [
      "accountId"
    ],
    "idempotency": "fresh_scratch_org_once_per_case",
    "output": {
      "format": "salesforce_cli_json_log",
      "marker": "JATAKA_BINDINGS=",
      "value": "json_object"
    },
    "script": "scripts/seed.apex",
    "script_sha256": "a3ba26302f72b1cd7f08f2e287642bca116971650e6966f20c45bfad9f11b1d1"
  }
}
